{
  "schema": "lightning.accept.scene/1",
  "id": "opaque-mix",
  "title": "普通/实心/发光/薄面/箱子/管件混排（纹理与几何的回归基线）",
  "world": {
    "region": "cp_accept_opaque_mix",
    "origin": [
      64,
      12,
      64
    ],
    "dim": 0,
    "time": 6000,
    "weather": "clear"
  },
  "blocks": [
    {
      "block": "stone",
      "at": [
        0,
        0,
        0
      ]
    },
    {
      "block": "planks",
      "at": [
        1,
        0,
        0
      ]
    },
    {
      "block": "dirt",
      "at": [
        2,
        0,
        0
      ]
    },
    {
      "block": "glowstone",
      "at": [
        3,
        0,
        0
      ]
    },
    {
      "block": "slab",
      "at": [
        4,
        0,
        0
      ]
    },
    {
      "block": "magnetic-flux",
      "at": [
        0,
        0,
        1
      ]
    },
    {
      "block": "gravity-stab",
      "at": [
        1,
        0,
        1
      ]
    },
    {
      "block": "chest",
      "at": [
        2,
        0,
        1
      ]
    },
    {
      "block": "lp-pipe",
      "at": [
        3,
        0,
        1
      ]
    }
  ],
  "cameras": {
    "views": [
      "front",
      "back",
      "left",
      "right",
      "top",
      "bottom"
    ],
    "axonometric": [
      {
        "name": "iso-ne",
        "yaw": 225,
        "pitch": 30
      }
    ],
    "orthoHeight": "auto",
    "resolution": [
      1920,
      1080
    ]
  },
  "export": {
    "name": "opaque-mix",
    "shape": "world"
  }
}
