{
  "schema": "lightning.accept.scene/1",
  "id": "calibration",
  "title": "机位标定：三轴染色标记 + 一块玻璃 + 一块实心（机位错则一切免谈）",
  "world": {
    "region": "cp_accept_calibration",
    "origin": [
      64,
      12,
      64
    ],
    "dim": 0,
    "time": 6000,
    "weather": "clear"
  },
  "blocks": [
    {
      "block": "wool-white",
      "at": [
        0,
        0,
        0
      ],
      "note": "原点：白色，作为世界↔像素的锚"
    },
    {
      "block": "wool-red",
      "at": [
        1,
        0,
        0
      ],
      "note": "+X 红"
    },
    {
      "block": "wool-green",
      "at": [
        0,
        0,
        1
      ],
      "note": "+Z 绿"
    },
    {
      "block": "wool-blue",
      "at": [
        0,
        1,
        0
      ],
      "note": "+Y 蓝"
    },
    {
      "block": "glass",
      "at": [
        2,
        0,
        0
      ],
      "note": "透明参照"
    },
    {
      "block": "stone",
      "at": [
        2,
        0,
        1
      ],
      "note": "实心参照"
    }
  ],
  "cameras": {
    "views": [
      "front",
      "back",
      "left",
      "right",
      "top",
      "bottom"
    ],
    "axonometric": [
      {
        "name": "iso-ne",
        "yaw": 225,
        "pitch": 30
      },
      {
        "name": "iso-nw",
        "yaw": 315,
        "pitch": 30
      },
      {
        "name": "iso-high",
        "yaw": 225,
        "pitch": 60
      }
    ],
    "orthoHeight": "auto",
    "resolution": [
      1920,
      1080
    ]
  },
  "export": {
    "name": "calibration",
    "shape": "world"
  }
}
